{
  "bindings": [
    {
      "artifact_path": "shards/shard-001.json",
      "artifact_sha256": "f3c1d2892ea2b1a2d7965a8b58cde94298e4f9188a9dca46fe71ca2a716a31b0",
      "candidate_id": "SYNTHETIC_CANDIDATE_PLACEHOLDER_V1",
      "context_id": "pfgen:v1:family=VS_LIMPERS:hero=CO:opener=NONE:lastagg=NONE:callers=0:limpers=1:jam=0:stack=B3_P50_P75",
      "generation_id": "SYNTHETIC_HERO_PREFLOP_CONTRACT_FIXTURE_V1",
      "population_id": "pokerstars_nlhe_100-200_zoom_play_6max_v1",
      "shard_id": "SYNTHETIC-SHARD-001",
      "stack_bucket": "B3_P50_P75"
    },
    {
      "artifact_path": "shards/shard-001.json",
      "artifact_sha256": "f3c1d2892ea2b1a2d7965a8b58cde94298e4f9188a9dca46fe71ca2a716a31b0",
      "candidate_id": "SYNTHETIC_CANDIDATE_PLACEHOLDER_V1",
      "context_id": "pfgen:v1:family=VS_LIMPERS:hero=SB:opener=NONE:lastagg=NONE:callers=0:limpers=1:jam=0:stack=B2_P25_P50",
      "generation_id": "SYNTHETIC_HERO_PREFLOP_CONTRACT_FIXTURE_V1",
      "population_id": "pokerstars_nlhe_100-200_zoom_play_6max_v1",
      "shard_id": "SYNTHETIC-SHARD-001",
      "stack_bucket": "B2_P25_P50"
    }
  ],
  "candidate_id": "SYNTHETIC_CANDIDATE_PLACEHOLDER_V1",
  "generation_id": "SYNTHETIC_HERO_PREFLOP_CONTRACT_FIXTURE_V1",
  "lookup_policy": {
    "fallback_states": [
      "EXACT_GENERATED",
      "EXACT_INCUMBENT_FALLBACK",
      "EXACT_UNAVAILABLE"
    ],
    "mode": "EXACT_CONTEXT_ONLY",
    "nearest_context_allowed": false
  },
  "population_id": "pokerstars_nlhe_100-200_zoom_play_6max_v1",
  "schema": "poker-hero-preflop-generation-binding/v1"
}
